URL,Date,Title,Author,Article
https://news.asu.edu/20251105-arts-humanities-and-education-asu-student-honors-grandfather-legacy-storytelling,2025-11-05T16:24:21-07:00,ASU student honors her grandfather’s legacy through storytelling,By Mariana Lozovanu,"West Valley campus course inspires students to preserve veterans’ stories through communication, civic engagement

W. P. Carey School of Business student Kayla Burns with her grandfather George Burns, now 85, who served in the U.S. Navy for 21 years. Courtesy photo

Editor's note: ASU is celebrating Salute to Service Nov. 7–16, which honors individuals and their families who put service above self in both their professional and personal lives.

This fall at Arizona State University's West Valley campus, a new communication course is teaching students that storytelling can do more than inform — it can preserve history, strengthen family bonds and give veterans a lasting voice.

COM 294 – Living History: Communicating Veteran Stories, taught by Instructor Trinity Winton in the School of Social and Behavioral Sciences, launched in partnership with Imprints of Honor, a nonprofit dedicated to documenting veterans’ lived experiences. 

ASU hosts 'welcome home' tribute for Vietnam veterans during Salute to Service

As part of the course, students interview a veteran, write and publish their story in an online volume and have the story archived in the Library of Congress — turning classroom work into permanent records of American history.

For W. P. Carey School of Business student Kayla Burns, the assignment became deeply personal.

“This class is very important to me because the military has been such a big part of my family’s history,” Burns said. “Telling my grandfather’s story has changed my life;it brought us closer and helped me understand his service in a way I never had before.”

Kayla’s grandfather, George Burns, now 85, served in the U.S. Navy for 21 years and worked on navigational and optical equipment, including binoculars, periscopes and the instruments that kept ships running.Through the interview process, Kayla discovered how the discipline and exacting standards of naval life shaped him.

“Everything had to be clean, neat and precise,” she said. “Even as a kid at his house, everything had a place. I always thought grandpa was just strict, but learning about the rules and procedures he followed in the optical room made me understand why he was that way.”

Those technical details revealed character traits other family stories had never explained: lifelong attention to detail, a drive to set and meet goals, and a belief that steady effort and skill matter. Kayla says the process also made room for surprising tenderness.

“He came alive when we talked about the technical stuff,” she said. “Seeing him remember and explain those details, you could tell it meant a lot to him. I think there was real healing in that.”

Winton created the course to pair civic engagement with empathy-driven communication. Winton, whose husband is an Air Force veteran, sees the project as a way to preserve the complexity of veterans’ lives: the pride, the routines and the deep reflections that often follow service.

“There’s so much civilians don’t know about what military life is like — the beautiful, the challenging and the heartbreaking,” Winton said. “If we lose those voices, we lose their lessons. This class gives students the opportunity to preserve those stories for future generations.”

Beyond developing interviewing and writing skills, the course cultivates civic literacy, compassion and a sense of shared responsibility. Veterans receive the validation that their service and memories matter; students learn the ethics and craft of listening well.

Kayla describes how the project deepened family conversations. Her father joined her for the interview sessions, and the family has since talked openly about military life in ways they hadn’t before.

“Preserving his story has really strengthened our bonds,” Burns said. “We’re embracing that history more; it’s deepening my connection to my grandfather.”

Not all memories were easy to access. Kayla found that some topics were off-limits; but the moments of vulnerability that did surface were powerful, particularly when George reflected on the bitter reception many Vietnam-era veterans faced after returning home.

Kayla also hopes readers will notice the often-overlooked roles in military history. Her grandfather’s work in the optical room, the hands-on maintenance and precision, may not make headlines, but it kept crews and ships safe and effective.

“I want people to remember the value of the ‘little guys’ who keep the whole machine running,” she said. “Without every cog, the machine won’t work.”

COM 294’s partnership with Imprints of Honor and the Library of Congress ensures these narratives reach beyond the classroom. Student interviews become part of a national archive, accessible to researchers, family members and future generations seeking to understand the everyday realities of service.

“Humans are storytelling creatures,” Winton said. “It’s our duty to listen, learn and make sure these memories are never lost.”

 

Arizona State University alumnus Dylan Park-Pettiford has spent most of his life caught between worlds.Born in the Bay Area to a Black father and a Korean mother, he learned early how belonging could…

Red is the color that best embodies the range of energetic expression in toddlers, and that’s why Amanda Pintore named her family-friendly dance performance “Red.”“This is for 12- to 36-month-olds,…



  
  
    
        





  


  The 1982 novel ""The Running Man"" was written by Stephen King under the pseudonym Richard Bachman.


In 1982, Richard Bachman wrote a novel about a reality show in…


Contact ASU News


Manage subscriptions"
https://news.asu.edu/20251031-arts-humanities-and-education-asu-professor-creates-red-interactive-dance-toddlers,2025-10-31T23:03:05-07:00,"ASU professor creates 'Red,' an interactive dance with toddlers",By Mary Beth Faller,"Amanda Pintore designs performances based on her research methodology with very young children

Amanda Pintore, assistant professor in the School of Music, Dance and Theatre at ASU, performs “Red” during a dress rehearsal Wednesday, Oct. 29, at the Mesa Arts Center. The dance is designed for families and children ages 12 to 36 months, who are welcome to interact with the dancers. Photo by Charlie Leight/ASU News

Red is the color that best embodies the range of energetic expression in toddlers, and that’s why Amanda Pintore named her family-friendly dance performance “Red.”

“This is for 12- to 36-month-olds, so we’re exploring joyful chaos, rough-and-tumble play, connection making and expression,” said Pintore, an assistant professor in the School of Music, Dance and Theatre at Arizona State University.

“Red” is an interactive performance for toddlers and their families, who all dance together with Pintore. The show debuted Oct. 30 and runs through Nov. 9 at Mesa Arts Center, with several performances scheduled after that at the Children’s Museum of Phoenix.

Pintore earned her MFA in youth theater at ASU in 2017, and her thesis explored how to collaborate with very young children and their family members in the dance process.

“It was not just thinking about them as audience members, but as co-artists,” she said.

She then worked as associate director of performing arts and education at the Lawrence Arts Center in Kansas and won a grant to further explore the discipline of theater dance for young children, working with them at universities, arts organizations, libraries and community spaces.

She developed a methodology, which she calls a “play lab,” for conducting research with young children and then using the results to create a performance, usually with a team of researcher-performers.

“At first, we make as few decisions as possible about the show. Usually we have a hunch, a core idea,” she said.

Then they have a structured series of play labs with children, and sometimes also the caregivers, in which the performer-researchers follow the lead of the little ones.

The session is recorded, and Pintore has a system for assigning codes to various outcomes during the session — actions like jumping or spinning, the energy level in the room, whether the participants are playing together, what is said. Then she looks for themes in the codes to further shape a concept. The performer-researchers rehearse to create a performance, return to the play lab to workshop it and then rehearse some more.



Dancer-researcher Olivia Herneddo (center), a lead experience designer for ASU Enterprise Technology, moves with Amanda Pintore, an assistant professor of youth theater, as they perform “Red” during a dress reheasal Wednesday, Oct. 29, at the Mesa Arts Center. The show will run through Nov. 9 there. 

Photo by Charlie Leight/ASU News



Lindsay Vanegas sits with her children, Violet, 4, and Elias, 6, as Amanda Pintore and Olivia Herneddo rehearse “Red” at the Mesa Arts Center. The performance is designed for families and children ages 12 to 36 months, who are welcome to interact with the dancers. 

Photo by Charlie Leight/ASU News



Amanda Pintore (right) and Olivia Herneddo perform “Red” at the Mesa Arts Center. The dance features a pair of red sweaters connected by a 17-foot-long sleeve, created by ASU alumna Brenna Halvorsen, who also designed the costumes. Installation artist Alicia Kelly made the red and white banners. 

Photo by Charlie Leight/ASU News



An interactive dance performance with toddlers potentially could be hectic, but Amanda Pintore (front) said the hours of research help the performer-researchers anticipate everything that might happen. “There’s a pretty big range of participation, observation and activation in this age range. And we are trained to handle whatever happens in the room,” she said. They also help prepare the participants with a pre-show talk and at the end help them transition back into their day.

Photo by Charlie Leight/ASU News

Pintore also bases the performances on the intended participants. When she works with preschools, there could be up to 20 children.

“This is their space. This is a different kind of energy. I always say to people, ‘I have a really high capacity for chaos because there's a lot that goes into the mix there.’”

When she works with families, the groups are smaller.

“We never work with more than seven family units at a time because we have bigger bodies in space,” she said. “Red” will have 25 total participants.

ASU professor explores theater, dance for young children in new book.

Her research led to her recent book, “Theatre and Dance with Children as Artistic Partners: Devising Performance for the Very Young,” which describes her play lab framework for creating a performance (along with tips, like delegating some of the time-consuming coding).

She also teaches a course on how to create theater dance for young children that collaborates with the Child Development Lab preschool on campus.

An interactive dance performance with toddlers potentially could be hectic, but Pintore said the hours of research help the performer-researchers anticipate everything that might happen.

“There’s a pretty big range of participation, observation and activation in this age range. And we are trained to handle whatever happens in the room,” she said.

They also prepare the participants, starting with a pre-show chat.

“There will be babies who are going to stay in that seat the whole time because they're in an observation space. And children can move freely in and out of the central playing space with us.”

Olivia Herneddo, a lead experience designer for ASU Enterprise Technology, is the other dancer-researcher along with Pintore for the performances of “Red.” The digital musical score is by Ji Sun Myung, an instructional specialist in the School of Music, Dance and Theatre, who will improvise part of the performance.

“She is going to be not only playing live music that we have built for the show, but we also have open sections with no planned choreography where we just will see what's happening in the room and she will play with us,” Pintore said.

At the end of “Red,” which lasts 35 minutes, the researchers help families transition back into their day.

“We want caregivers to feel comfortable watching their child in this experience, having this moment together,” she said.

“What's most beautiful is seeing the child-caregiver connection and then watching children connect with their peers that they've never met before.”

 

Arizona State University alumnus Dylan Park-Pettiford has spent most of his life caught between worlds.Born in the Bay Area to a Black father and a Korean mother, he learned early how belonging could…

This fall at Arizona State University's West Valley campus, a new communication course is teaching students that storytelling can do more than inform — it can preserve history, strengthen family…



  
  
    
        





  


  The 1982 novel ""The Running Man"" was written by Stephen King under the pseudonym Richard Bachman.


In 1982, Richard Bachman wrote a novel about a reality show in…


Contact ASU News


Manage subscriptions"
https://news.asu.edu/20251030-business-and-entrepreneurship-thunderbird-asu-ranked-no-1-world-international-trade-fourth,2025-10-30T08:56:33-07:00,Thunderbird at ASU ranked No. 1 in the world for international trade for fourth consecutive year,By Nicole Almond Anderson,"Global ranking places Thunderbird ahead of Cambridge, Oxford and Columbia

Ranked the world’s No. 1 school for international trade for the fourth consecutive year, Thunderbird at ASU immerses students from around the globe in a dynamic, connected ecosystem, celebrated in the Parade of International Flags that showcases the school’s global spirit. ASU photo

For the fourth consecutive year, Thunderbird School of Global Management at Arizona State University has been recognized as the world leader in international trade by Quacquarelli Symonds (QS), the prestigious global authority on higher education rankings.

This year’s QS International Trade Rankings (2026) for MBA and master’s programs once again position Thunderbird as the No. 1 school in the world. The school ranks ahead of Columbia University, the University of Michigan - Ann Arbor (Ross) and the University of North Carolina at Chapel Hill (Kenan-Flagler) in the U.S., as well as the University of Cambridge, the University of Oxford and the National University of Singapore internationally.

“We are deeply honored to once again be recognized as the world’s top institution for international trade,” said Charla Griffy-Brown, director general and dean of Thunderbird. “Earning this distinction repeatedly among the world’s leading MBA and master’s programs underscores our unwavering commitment to preparing future-ready global leaders in one of the most dynamic and comprehensive fields of study.”

Thunderbird earned an overall score of 100 out of 100 points — ranking first among nearly 110 universities and business schools worldwide offering graduate programs in international trade. This achievement reaffirms the school’s position as a global leader in impact, innovation and academic excellence. Notably, Thunderbird is one of only three institutions to exceed the 90-point mark, with the next highest-ranked school, the National University of Singapore, following at 92.6 points — further underscoring Thunderbird’s preeminence in international trade education.

In this year’s rankings, Thunderbird once again stands as the only school from the United States — and the entire Americas — ranked among the global top 10, with Columbia University following at No. 11. The school likewise held this distinction in 2025 and, in 2024, was one of only five U.S. universities to reach the top 10.

This is also the only global No. 1 subject ranking across all of Arizona State University, highlighting Thunderbird’s distinct global impact within ASU’s world-class ecosystem.

Thunderbird’s world-class faculty are central to this recognition. They actively participate in many of the world’s leading academic and industry organizations, including the Academy of International Business, Council on Foreign Relations, Global Network of Business Schools, International Studies Association, United Nations Global Compact, and numerous World Economic Forum councils. Locally, faculty and students are engaged with the Arizona District Export Council, the Diplomatic Corps of Arizona, the Phoenix Council on Foreign Relations, and other key regional organizations.

Thunderbird faculty are also regularly featured and cited in leading international outlets, contributing scholarship and policy insights that shape global discourse. Their work has informed the strategies of prominent global institutions and has been referenced at the highest levels of policymaking. Influential bodies such as the United States International Trade Commission, the National Intelligence Council, the United States Senate, and the Departments of State and Defense have drawn upon this research — reinforcing Thunderbird’s impact in shaping international trade policy.

“I have the pleasure of seeing our incredible faculty and staff delivering a level of expertise and global perspective — and at a pace and scale — that is simply unmatched,” said Lena Booth, deputy dean of Thunderbird Academic Enterprise and finance professor at Thunderbird. “It’s proof that our students leave us ready to shape the future. They emerge confident, globally minded and equipped to lead and make a real impact wherever their careers take them.”

Developed in collaboration with the Hinrich Foundation, schools are evaluated across several key performance indicators, including trade program content, graduate outcomes, industry engagement, innovative teaching, reputation, research and program delivery. The QS rankings specifically highlight Thunderbird’s flagship Master of Global Management (MGM) program as the premier graduate program in international trade.

“Thunderbird’s MGM is recognized for its strong global orientation and practical approach to leadership development,” said Alex Boome, program director at the Hinrich Foundation. “With its flexible curriculum, transdisciplinary concentrations and emphasis on experiential learning, the program equips graduates with the skills and mindset to succeed in today’s interconnected and digitalized business environment.”

As part of the QS World University Rankings, the International Trade Rankings guide prospective students toward programs that equip them for success in global trade, while providing universities with a framework to benchmark and advance the quality and impact of trade education worldwide. As such, Thunderbird’s various degree programs continue to draw aspiring global business leaders who seek to make a lasting impact across the private, public and nonprofit sectors.

“What sets the Thunderbird student experience apart is that it’s unlike anywhere else in the world,” Griffy-Brown said. “Our students engage with a globally forward-thinking hub of accelerated innovation, technology and entrepreneurship, whether on campus or through our flexible online programs. They are immersed in a dynamic ecosystem where ideas meet real-world application, preparing them to lead with confidence on a global scale. Thunderbird isn’t just a place to learn — it’s a place to transform how you see the world and your role in shaping it.”

 

On a rainy fall afternoon, the McCord Hall conference room on Arizona State University’s Tempe campus carried the quiet hum of anticipation. A group of veterans that included both men and women who…

They may have just stepped out of their teens, but they’re already stepping up to change the world. The latest ""AZ Inno Under 25” list, published by the Phoenix Business Journal, includes four…

Max Bregman’s drive to change the world became personal when he couldn’t charge his electric vehicle at home, despite having chargers in his apartment complex, because of the lack of a management…


Contact ASU News


Manage subscriptions"
