URL,Date,Title,Author,Article
https://news.asu.edu/20251022-science-and-technology-campus-company-how-research-sparked-new-water-tech-startup,2025-10-22T15:53:26-07:00,From campus to company: How research sparked a new water tech startup,By Faith Kearns,"Enrique Vivoni's startup Tributary helps groups measure the real water outcomes of forest restoration projects

The results of recent tree-thinning efforts — aimed at restoring the forest to a density that can withstand occasional low- to medium-intensity fires — in the Baker Butte area near Payson, Arizona. An ASU professor's startup company helps measure the water benefits of forest management efforts like these. Photo by Wren Raming

Wildfire seasons are getting longer and hotter, threatening forests and the water supplies they protect.

Forest restoration, especially thinning dense stands of trees, can reduce wildfire risk and improve water availability — but measuring the water benefits of forest management has been challenging.

That’s why Arizona State University Professor Enrique Vivoni founded the startup company Tributary. Its mission is to give utilities, governments, nonprofits and companies better tools to measure the real water outcomes of forest restoration projects.

The technical work is complex, but the outcomes are simple.

“Clients don’t want to wade through equations,” Vivoni says. “They want to know: How much water will this project save each year? That’s the translation we provide.”

As the ASU Fulton Professor of Hydrosystems Engineering in the School of Sustainable Engineering and the Built Environment, in the Ira A. Fulton Schools of Engineering, and director of the Center for Hydrologic Innovations, Vivoni has built a career teaching, mentoring and conducting research in hydrology and water resources in arid regions like Arizona.

• Vivoni's recent study on ""hot droughts"" shows the effect drying soils in northern Mexico can can have on the southwestern U.S.

• Vivoni earns three prestigious fellowships for advancing research in water systems and climate resilience

Tributary grew out of decades of research and a desire to make his expertise useful beyond academia. 

Vivoni teamed up with Zhaocheng Wang, an expert in remote sensing and AI, and Josh Cederstrom, an expert in technology development, and the trio is designing Tributary to bring this science to the market.

“This is a full-scale effort to make a real impact,” Cederstrom says. “We are taking rigorous science and making it usable for water managers and utilities.”

Vivoni’s connection to water and forests began in Puerto Rico. As a scout leader, he camped near a human-made lake surrounded by protected forest.

“That was my entry point to conserving forests for water supply,” he says. “That formative experience led me to pursue college degrees in this field.”

As a graduate student at MIT in the early 2000s, Vivoni imagined starting an environmental tech company. But the dot-com bust convinced him the technology wasn’t quite ready.

Two decades later, new conditions — including generative AI, open-source software, advanced remote sensing and Arizona’s historic investment in water research through the Arizona Water Innovation Initiative that Vivoni is a part of — created a different, market-ready landscape.

“These pivots created the right moment for Tributary to emerge,” he says.

The launch of the Center for Hydrologic Innovations also helped, providing structure for collaboration and linking research to Arizona’s water challenges. Out of this foundation, the idea for Tributary began to take shape.

The push from concept to company came from real-world demand. Utilities like Salt River Project wanted better ways to measure the water benefits of forest thinning.

“That gave us the momentum to launch,” Vivoni says. “Our contribution is to translate peer-reviewed science into outcomes that water managers actually need.”

The focus on user needs is already paying off.

“The innovative work Enrique Vivoni, ASU and Tributary are doing helps SRP understand the watershed benefits of forest thinning,” says Elvy Barton, manager of water and forest sustainability at Salt River Project. “Tributary is providing key watershed metrics and data that allows SRP to clearly articulate the benefits of wildfire resilience and healthy forest projects to our partners.”

Healthy forests act like natural infrastructure: storing and releasing water and reducing wildfire risk. Restoration can improve water supplies, but measuring those benefits has relied on rough estimates that miss the complexity of Arizona’s landscapes.

Tributary changes that. The company uses lidar scans to map forest structure, combining them with data on topography, soils and precipitation to model how thinning trees affects the water cycle.

“Commercial Earth observation has been advancing for decades,” Wang says. “Advances in AI are pushing this further, enabling products like the first-ever global one-meter-resolution forest maps. The combination of high resolution, low latency, high accuracy and low cost makes this ideal for monitoring changes like wildfire and thinning anywhere.”

As innovation director for Tributary, Wang leads the development of new products and helps transfer ASU technology into practical tools by making university-developed research more accessible, faster and cheaper — but just as accurate — for customers.

“A huge part of my role is about tech transfer, and we are lucky to have a lot of support through ASU. I’m working with Skysong, a technology accelerator, to patent methods developed at ASU and bring them into real-world engineering projects,” Wang says.

For Cederstrom, who serves as technical director for Tributary, ASU’s water startup ecosystem made the leap from industry and back to the university possible.

“Between the Arizona Water Innovation Initiative, the Center for Hydrologic Innovations and SkySong, there’s a whole structure to help researchers move ideas into action,” he says.

The name Tributary reflects both hydrology and history. In nature, a tributary is a small stream feeding a larger river, which is an apt metaphor for a startup contributing knowledge to bigger sustainability efforts.

It also nods to Vivoni’s earlier work on the widely used tRIBS hydrologic model, refined by a global research community for more than 20 years and now used as a basis for Tributary's work.

Though based in Arizona, Tributary’s ambitions extend far beyond. The need for healthier forests and smarter water management is global.

“In Arizona,” Vivoni says, “we’re piloting solutions that can scale not only across the western U.S., but for the world.”

That scaling depends on people as much as tools. Vivoni emphasizes the role of students who carry forward the science and skills honed at ASU. Tributary is one successful example of a larger effort at ASU to develop a water technology startup ecosystem in Arizona.

“This is about the human capital we’re developing,” he says. “I’m leading Tributary now, but over time I’ll step back and serve more as an advisor as others take it forward.”

Tributary represents more than a startup story. It’s an example of how universities can export knowledge to the world. For Arizona, it means turning research into practical solutions for water and forest management.

“In a sense, what we’re exporting is knowledge,” Vivoni says. “It’s taking what universities do best— long-term, rigorous science — and making it usable outside the campus walls.”

Research is the invisible hand that powers America’s progress. It unlocks discoveries and creates opportunity. It develops new technologies and new ways of doing things.

Learn more about ASU discoveries that are contributing to changing the world and making America the world’s leading economic power at researchmatters.asu.edu.

 

When it comes to organization, even cells have their own preferred system.While genetic engineers can design and assemble sophisticated gene circuits to program cells with new functions, as these…

From his third-floor office at Arizona State University, floor-length windows give Sethuraman Panchanathan a stunning panorama of the sprawling Tempe campus.But the view is not new to …

Today, there are approximately 14,000 active satellites in orbit around Earth. The number is expected to grow to more than 65,000 by 2030. This rapid expansion of the space economy is outpacing the…


Contact ASU News


Manage subscriptions"
https://news.asu.edu/20251106-health-and-medicine-life-service-how-asus-cheryl-schmidt-turned-duty-legacy,2025-11-06T17:24:37-07:00,A life of service: How ASU’s Cheryl Schmidt turned duty into a legacy,By Marshall Terrill,"The Arizona Veterans Hall of Fame inductee has served as an Army nurse, an advocate and an educator

ASU Clinical Professor Cheryl Schmidt talks about her military service with her Community Health Nursing students in Sands Hall on the West Valley campus. She has been a nurse for 55 years, including a role as a U.S. Army nurse; is an advocate for veterans and nurses to receive recognition and resources; and has been an instructor on disaster preparedness to more than 20,000 nursing students nationwide. In October, Schmidt was inducted into the Arizona Veterans Hall of Fame, joining 23 others honored for service beyond their military careers. Photo by Charlie Leight/ASU News

When Cheryl Schmidt was a little girl in rural Ohio, she would watch her mother dress for work —crisp white uniform, nursing cap perched perfectly in place. Her mother had been a nurse and taught cadet nurses during World War II. To young Cheryl, she wasn’t just a caregiver — she was a symbol of dignity and strength.

“I always wanted to be like Mom,” said Schmidt, a clinical professor at Arizona State University’s Edson College of Nursing and Health Innovation. “I said, 'I’m going to be a nurse just like her.'”

That promise became the foundation of a life of service spanning five decades: as a U.S. Army nurse, as an educator shaping generations of students, and as an advocate ensuring veterans and nurses alike receive the recognition and resources they deserve.

On Oct. 24, at age 76, Schmidt was inducted into the Arizona Veterans Hall of Fame, joining 23 others honored for service beyond their military careers. For her, it’s more than a medal. It’s a recognition of a lifetime spent answering the call — whether from the Army, the Red Cross or the nursing students she continues to mentor today at Edson College.

“Dr. Schmidt personifies the highest standards of civic and veteran volunteer spirit expected of nominees for the Arizona Veterans Hall of Fame,” said Lisa Jaurigue, a clinical associate professor at Edson College who nominated Schmidt to the Arizona Veterans Hall of Fame Selection Committee. “As a nurse of 55 years, she continues to serve civilian and veteran communities. In her career thus far, she has been nominated for or awarded 66 awards.”

Schmidt joined the Army in 1974, in the shadow of the Vietnam War. 

“I actually signed up to go to Vietnam,” she said. “But there was a waiting list of nurses. Can you believe that? So I joined the reserves and stayed in.”

It was in the reserves where she built her military career teaching medics, coordinating national disaster drills and eventually rising to lieutenant colonel during Operation Desert Storm. Her family history made service feel inevitable: Her father was in the Army, her brother served in the Navy and her mother was a cadet nurse educator.

But her path almost took a very different turn. As a teenager, Schmidt interviewed to become a nun.

“They asked me if I had ever dated, and I said no because all the nice boys were going steady,” she said, laughing. “The nun told me, ‘Go date for a year and then come back.’ Instead, I went to nursing school. And I never went back.”

From her earliest days in uniform, Schmidt found herself in leadership roles. She already held a master’s degree when she joined, and the Army wasted no time putting her skills to use.

She taught medics for six years, coordinated mock battlefield drills with soldiers covered in fake wounds, and even handled helicopter evacuations using radio codes.

“It was basically leadership from day one,” she said.

When Desert Storm erupted in 1990, Schmidt prepared to deploy overseas with her unit as assistant chief nurse. But an injury while moving heavy boxes left her with permanent back damage. Instead of Saudi Arabia, she was sent to Walter Reed Army Medical Center in Washington, D.C., where she spent six months running the pediatric unit.

“It was bittersweet,” she admitted. “I had survivor guilt. I didn’t get to Vietnam. I didn’t get to Saudi Arabia. But at Walter Reed, I cared for children of military families from all over the world. I saw diseases I’d only read about in textbooks. It made me a better teacher when I came home.”

Schmidt never stopped teaching. For over 51 years, she has taught at programs in Ohio, Michigan, North Dakota, Arkansas and now Arizona. Her specialty became community health and disaster nursing. These are fields that many students initially overlook but that she makes come alive with real-world stories.

“I tell my students, ‘You may want ICU glory, but if you send a patient home without proper support, and they’re readmitted within 30 days, Medicare won’t pay,’” she says. “That gets their attention.”

Her philosophy is rooted in action. Schmidt was living in Arkansas when the state took in 70,000 evacuees after Hurricane Katrina. Only five nurses in the state were trained in Red Cross disaster shelters. Schmidt trained 180 more almost overnight, then began integrating disaster preparedness into nursing curricula nationwide.

Since 2009, she estimates she has trained more than 20,000 nursing students in disaster response.

“You have to be able to think on the fly,” she said. “Sometimes you have no resources. You just show up, and there you are.”

Schmidt’s advocacy doesn’t end with nursing. As a disabled veteran herself, she has fought to make sure others like her get the care and recognition they deserve. She currently serves on the American Academy of Nursing’s Expert Panel on Military and Veterans Health, where she helped launch the national campaign “Have You Ever Served?”, which encourages health care providers to ask patients about military service so they can better diagnose and treat conditions linked to exposures such as Agent Orange and burn pits.

She also champions recognition for those who have been overlooked, especially nurses. More recently, Schmidt has been lobbying Congress to award World War II nurses the Congressional Gold Medal. Many, she points out, stayed behind during the Bataan Death March in the Philippines, choosing to care for soldiers even at the cost of their lives.

“Nobody recognizes them,” she says. “And yet they gave everything.”

As a woman in uniform, Schmidt also saw firsthand the challenges that women veterans continue to face, from harassment to systemic underestimation. She recalls turning down unwanted advances from commanders and fellow soldiers alike.

“A lot of women weren’t so lucky,” Schmidt said.

Her doctoral work examined women’s roles in the military. Her conclusion is that service should be based on physical ability, not gender. Women, she argues, bring strengths from communications to leadership that are just as vital as physical muscle.

“As a nurse educator, Cheryl has spent the last five decades sharing her immense knowledge and experience and has inspired thousands of nurses,” said Wanda Wright, director of ASU’s Office for Veteran and Military Academic Engagement. “Her service to veterans both as an Army veteran herself and through disaster and public health initiatives reminds us how important the profession of care can be.”

If there is a single thread through Schmidt’s life, it is mentorship. She takes special pride in lifting up young nurses. People like Elizabeth Wakefield, the ASU student she guided from a first-term novice to state president of the Student Nurses’ Association of Arizona, now winning national awards.

“My mantra is, 'You’re not a professional nurse unless you belong to a professional organization,'” Schmidt said. “Otherwise, you’re just a clock-puncher. Leadership matters.”

Even today, she brings that philosophy into the classroom, telling stories that blend military precision with human compassion. Her students, she notes, consistently give her top ratings not because the coursework is easy, but because she makes it matter.

“Dr. Schmidt has played a pivotal role in shaping not only my education but also my professional and personal growth,"" Wakefield said. ""She has taught me to persevere through the challenges of nursing school, to pursue leadership roles and to seize opportunities for growth, such as presenting at national conventions, publishing, volunteering in the community and building disaster-preparedness skills. 

“She leads by example, showing up with a smile, dedicating herself to service and encouraging every student to achieve more than they thought was possible. … Personally, I can say with certainty that I would not be the nursing leader I am today without Dr. Schmidt’s mentorship.”

I’ve always felt proud to be an Army nurse. And if my story can help others, then it’s worth telling.

Perhaps Schmidt’s drive comes from a moment when she almost lost everything. As a nursing student, she underwent surgery for a bowel tumor and nearly died from infection.

“I was in the corner of the room, looking down at my body,” she recalled. “I thought, ‘Oh, that’s me down there.’ It wasn’t scary. It didn’t hurt. It was actually kind of peaceful.”

Schmidt survived, but the experience left her determined never to waste the time she was given.

“Life is a gift,” she said.

For decades, Schmidt poured herself into her work with little thought of recognition. That’s why this year’s induction into the Arizona Veterans Hall of Fame feels so special.

“This is the first state I’ve lived in that honors veterans this way,” Schmidt said. “I never even knew it existed until a colleague told me to apply. To be chosen is humbling.”

“Our WAC-Army Women United Chapter 68 was pleased to have Dr. Schmidt join us,"" said Gabe Forsberg, corresponding secretary for the WAC – Army Women United. ""Her dedication to her profession and military service was exemplary and exactly the kind of person who deserves to be honored by the Arizona Veterans Hall of Fame. 

""Cheryl is always thinking of ways to help veterans, and has the unique skills and contacts to bring about positive change. We are delighted to call her our Army sister, and she serves as a true inspiration.”

True to form, Schmidt doesn’t see the honor as hers alone. She sees it as another platform and a way to elevate the work of nurses, veterans and students.

“I’ve always felt proud to be an Army nurse,” she said. “And if my story can help others, then it’s worth telling.”

 

More than half of American adults drink alcohol, and 17% of them binge drink, consuming more than five drinks in one sitting for men, or more than four for women. According to the Centers for…

It has long been understood that there are biological differences between sexes, but it has only been around a decade since federally funded biomedical research has been required to include females…

High-pressure jobs can come with chronic stress, long shifts and unpredictable schedules. These pressures, when not managed, can ripple into family life, affecting both parents’ and children’s…


Contact ASU News


Manage subscriptions"
