URL,Date,Title,Author,Article
https://news.asu.edu/20251110-health-and-medicine-untangling-influence-cannabis-use-binge-drinking,2025-11-10T16:16:37-07:00,Untangling the influence of cannabis use on binge drinking,By Kimberlee D’Ardenne,"Study finds cannabis use decreases likelihood of excessive drinking at a certain age

Cannabis use during late adolescence and early adulthood increases the risk of binge drinking. New research from the Arizona State University Department of Psychology shows that by age 24, cannabis use motivates people to drink less. iStock photo

More than half of American adults drink alcohol, and 17% of them binge drink, consuming more than five drinks in one sitting for men, or more than four for women. 

According to the Centers for Disease Control and Prevention, binge drinking costs the economy $250 billion each year and can lead to problems such as increased exposure to violence and injury, overdose, alcohol poisoning and, for women, risk of miscarriage or stillbirth.

This type of excessive drinking is most common among younger adults, and using cannabis during late adolescence or early adulthood is known to increase the risk of engaging in binge drinking. 

Now, new research from the Arizona State University Department of Psychology shows that this increase in risk of binge drinking from cannabis use varies with age, peaking around age 20.

“We found that during ages 18 to 20, cannabis motivates people to binge drink more often, while later in adulthood, around age 24, it motivates them to binge drink less. This dichotomy has consequences for prevention and treatment efforts,” said Jack Waddell, assistant professor of psychology at ASU and first author on the study.

The study used cannabis use and alcohol consumption data from the National Consortium on Alcohol and Neurodevelopment in Adolescence, a long-term study of over 500 participants with sites in California, Oregon, North Carolina and Pennsylvania. The work was published in Alcohol Clinical and Experimental Research.

Waddell described the interaction of cannabis use and alcohol consumption as a complex relationship. 

He has previously found that individuals who use both alcohol and cannabis report higher rates of substance use disorder than those who use just one. Yet, he has also found that many individuals who use both alcohol and cannabis perceive using them together as being protective against some of the negative consequences of excessive drinking.

In the current study, he and his collaborators expected using cannabis to consistently increase the likelihood of the study participants engaging in binge drinking, not for it to flip from enabling excessive drinking in late teens and early 20s to blunting it around age 24.

“People are reducing their binge drinking but they’re switching to cannabis. This can be viewed positively from a harm-reduction standpoint, but it is important to understand that there are still a lot of risks associated with cannabis use,” Waddell said.

Waddell wants to understand how people end up using more than one substance, and to do this, he plans to study how people think about and use substances on a day-to-day basis.

“What is it that motivates the transition from using one substance to more than one? Is it someone’s affective experiences — their emotions and moods — whenever they’re using alcohol or cannabis that makes them want to add the other? Is it the social environment?” he asked.

Going forward, Waddell plans to use technology-enhanced momentary assessments, which are questionnaires or check-ins delivered by push notification on an app or text message, to study people’s behavior in the moment. 

Having a finer-grained level of access to how different kinds of substance use interact with and influence each other will lead to better treatment and prevention strategies.

 

It has long been understood that there are biological differences between sexes, but it has only been around a decade since federally funded biomedical research has been required to include females…

When Cheryl Schmidt was a little girl in rural Ohio, she would watch her mother dress for work —crisp white uniform, nursing cap perched perfectly in place. Her mother had been a nurse and…

High-pressure jobs can come with chronic stress, long shifts and unpredictable schedules. These pressures, when not managed, can ripple into family life, affecting both parents’ and children’s…


Contact ASU News


Manage subscriptions"
https://news.asu.edu/20251107-health-and-medicine-asu-researcher-importance-considering-sex-differences-health-studies,2025-11-07T11:28:06-07:00,ASU researcher on the importance of considering sex differences in health studies,By Kimberlee D’Ardenne,"President's Professor Heather Bimonte-Nelson says that science has a lot left to discover about sex differences that will be impactful to human health across the lifespan. Photo by Laura Fields/Arizona State University

It has long been understood that there are biological differences between sexes, but it has only been around a decade since federally funded biomedical research has been required to include females in the U.S.

And it is more important than ever to recognize the importance of these differences and to fully fund research on women’s health, according to Arizona State University President’s Professor Heather Bimonte-Nelson, who has been studying female neurobiology and the impact of hormones during aging for decades.

For example, women are more likely to be misdiagnosed when having a heart attack than men. This discrepancy happens because women experience different symptoms from men, such as anxiety or shoulder pain — and until a few years ago, these symptoms were not widely publicized or communicated to the medical community.

Bimonte-Nelson recently authored an essay on how sex inclusivity in science benefits all of us. She explains that science has a lot left to discover about sex differences that will be impactful to human health across the lifespan.

Question: Why is it important for basic science research and clinical research to include both male and female participants?

Answer: Studies using only males make up the majority of the biomedical literature, but sex and sex hormones affect every level of our biology, from molecules to cells to entire systems, even including overall brain structure. Innumerable scientific principles and profiles of disease manifestation, symptom presentation and sequalaeThe aftereffects of a disease, condition or injury. are based on studies performed only in males, which means female data are interpreted to be a variant arising from a male-centric gold standard. This is inappropriate and insufficient at best. It should not be assumed that outcomes in one sex will apply to all individuals — because they do not.

Q: Does basic biology or cognition really differ across the sexes?

A: The short answer is yes.

Many developmental, neuropsychiatric, neurological and neurodegenerative disorders vary by sex in their prevalence, symptomology and progression. For example, premature female infants recover better from intracranial hemorrhage than do males; women are more likely to be diagnosed with post-traumatic stress disorder, anxiety disorders and major depressive disorders; and there is a male bias in the prevalence of autism spectrum disorders, with sex differences in symptom presentation including restricted, repetitive and externalizing behavior patterns. There are sex differences in long-term consequences of traumatic brain injury that have a distinct molecular-associated inflammatory signature. Women are nearly two times more likely than men to develop an adverse drug reaction. A report from the U.S. Government Accountability Office showed that of 10 drugs withdrawn from the U.S. market over a four-year time frame, eight of them had greater health risks in women, with the report concluding that this was driven by a lack of representation of females in the studies leading to FDA approval. Yet, the majority of drugs lack sex-specific recommendations and guidelines.

About a decade ago, the National Institutes of Health formally mandated that males and females must be considered in the design, analysis and reporting of all federally funded biomedical research. While this has been an important turning point, finding sex differences in a domain does not mean that they are well-characterized. Discovering driving mechanisms, symptomology and treatment outcomes are necessary to obtain the bigger picture and have a real impact on health and disease.

Q: What motivated you to study women’s health and cognition?

A: I am driven to discover factors that impact women’s health and sex differences relating to neurological functions because there is a marked knowledge gap in this domain. My lab focuses on neurological functions such as memory, depression and anxiety because they impact everyday quality of life in women.

Memory can decline with menopause, and depression and anxiety have been shown to increase during this time as well. How specific menopause types, prior hormone exposures and subsequent hormone therapies impact these outcomes have yet to be determined, but there is evidence that they each influence neurological function. My lab is working to decipher which variations of menopause and hormone exposures across the lifespan impact these brain functions and to identify the biological drivers of these effects. 

Q: What do you want everyone to understand about what there is to gain from studying sex differences?

A: Sex differences are one type of individual difference that are relevant to health and disease. Female biology, anatomy and function should not be dismissed and treated as irrelevant. We will not have rigor, precision and excellence in science and medicine without accuracy, and accuracy requires an accounting of the variables that impact health and disease. The studies done to date provide indisputable evidence that sex is one of these variables. Sex differences should be studied and embraced, and need not be a barrier to scientific discovery. Only when we embrace this source of individual variability will we have rigor, precision and excellence in science and medicine. ... When we have this, we impact all individuals.

 

More than half of American adults drink alcohol, and 17% of them binge drink, consuming more than five drinks in one sitting for men, or more than four for women. According to the Centers for…

When Cheryl Schmidt was a little girl in rural Ohio, she would watch her mother dress for work —crisp white uniform, nursing cap perched perfectly in place. Her mother had been a nurse and…

High-pressure jobs can come with chronic stress, long shifts and unpredictable schedules. These pressures, when not managed, can ripple into family life, affecting both parents’ and children’s…


Contact ASU News


Manage subscriptions"
https://news.asu.edu/2025110%207-science-and-technology-asu-spinout-swift-coat-grows-named-manufacturer-year,2025-11-07T12:27:28-07:00,"ASU spinout Swift Coat grows, named Manufacturer of the Year",By Joe Kullman,"Surface coating product boosts resilience of vital tech on Earth and in space

Swift Coat cofounder and chief executive officer Peter Firth foresees the company’s innovative product aiding the U.S. aerospace, semiconductor and high-tech manufacturing industries, as well as national defense. Photo by Erika Gronek/ASU 

Today, there are approximately 14,000 active satellites in orbit around Earth. The number is expected to grow to more than 65,000 by 2030. This rapid expansion of the space economy is outpacing the capabilities of the existing supply chain, which historically has been small, specialized and slow.

As governments and commercial entities race to claim their space in the sky, their pace has been throttled by long lead times for production of critical components — delays that threaten the success of missions essential to U.S. national defense and economic leadership in space.

Swift Coat, an Arizona State University spinout venture, is helping to confront that challenge.

Over the past 18 months, the company has adapted its proprietary coating technology, Aerosol Impaction-Driven Assembly, to enable domestic production of advanced coatings and components for the aerospace, solar and semiconductor industries.

One of its coatings boosts the power produced by solar panels on satellites by 4%, which enables reducing the size of panels as well as lowering satellite launch costs.

The results have led to more than $4 million in contracts within the aerospace industry.

To meet this growing demand, Swift Coat has expanded operations from its nucleation site in ASU’s MacroTechnology Works semiconductor fabrication facility into a 16,000-square-foot building in north Phoenix, where it plans to double its workforce within six months.

This growth trajectory has been noticed by the Arizona Chamber of Commerce & Industry and the Arizona Manufacturers Council, which has recently named Swift Coat Arizona’s Small Manufacturer of the Year.

“Swift Coat is exactly the kind of company we love to highlight,” says Grace Appelbe, executive director of the Arizona Manufacturers Council. “It’s homegrown, innovative and solving real-world challenges in smart, practical ways.”

“The Manufacturer of the Year Awards recognize companies that are creating quality jobs, contributing to Arizona’s economic growth, and keeping our state at the forefront of modern manufacturing,” Appelbe says. “That’s what makes Swift Coat a standout among this year’s honorees.”

Swift Coat was honored alongside other Arizona manufacturing leaders, including Axon (Large Manufacturer of the Year) and Four Peaks Brewing Company (Excellence in Sustainability), at the Manufacturer of the Year Awards on Oct. 28.

The Arizona Manufacturers Council described Swift Coat as having developed “cutting-edge coating technology” that enables producing many products and materials that are significantly more durable and energy efficient.

Swift Coat’s success reflects ASU’s growing role as a catalyst for Arizona’s manufacturing resurgence.

“It is emblematic of the ecosystem we’re building,” says Zachary Holman, vice dean for research and innovation in the Ira A. Fulton Schools of Engineering at ASU, who is also Swift Coat’s cofounder. “We’re proud to see companies that have gotten started at ASU earning recognition for advancing high-tech manufacturing and strengthening Arizona’s economy.”

Peter Firth, a graduate of the Fulton Schools and Swift Coat’s other cofounder and chief executive officer, attributes much of the company’s success to the early and continued support of ASU.

“ASU provided mentorship and access to resources in the company’s early days to help us bridge the gap between academia and industry,” Firth says. “Today we continue to partner with the university on projects in order to leverage their world-class facilities, faculty and students.”

Following its Small Manufacturer of the Year Award, Swift Coat will next expand its coating manufacturing capability to meet the demands of the growing U.S. aerospace market and launch new coating products for use in the semiconductor industry.

The company is building manufacturing capacity large enough to support the entire U.S. satellite market, which includes a multimillion-dollar investment in equipment and a doubling of staff over the next six months.

“With support from ASU, the Arizona’s Manufacturing Council and the Arizona Chamber of Commerce, we hope one day we’ll be considered for the council’s medium and large manufacturer of the year awards,” Firth says.

 

When it comes to organization, even cells have their own preferred system.While genetic engineers can design and assemble sophisticated gene circuits to program cells with new functions, as these…

From his third-floor office at Arizona State University, floor-length windows give Sethuraman Panchanathan a stunning panorama of the sprawling Tempe campus.But the view is not new to …

At Arizona State University’s Biodesign Institute, researchers are pushing the boundaries of what DNA can do — not just in terms of biological applications, but as a building block for next-…


Contact ASU News


Manage subscriptions"
https://news.asu.edu/20251104-local-national-and-global-affairs-asu-taiwan-strengthen-partnership-ties,2025-11-04T13:42:24-07:00,"ASU, Taiwan strengthen partnership ties",By Mary Beth Faller,"President Crow talks TSMC workforce, academic exchanges during visit

ASU President Michael Crow spoke at National Yang Ming Chiao Tung University during his visit to Taiwan last month. Like ASU, NYCU has expertise in semiconductors and also created one of the first biomedical engineering-based medical schools. ASU photo

As both Arizona State University and Taiwan have become major players in Arizona’s burgeoning semiconductor industry, the university has worked to nurture its ties to the island.

This fall, ASU President Michael Crow traveled to Taiwan to meet with top leaders in industry and education, as well as with ASU alumni.

“We talked about how ASU can partner and deliver workforce at scale for TSMC and other industry partners, as well as have a place for Taiwanese companies and innovations to grow in Arizona,” said Grace O’Sullivan, vice president of corporate engagement and strategic partnerships for ASU, who accompanied Crow to Taiwan.

ASU has seen an uptick of Sun Devils coming from Taiwan in recent years. Overall, 531 students from Taiwan studied at ASU in the 2024–25 academic year, an increase of more than 70% from 2021–22.

Also this fall, a delegation from Taiwan traveled to Arizona for SEMICON West, the flagship U.S. microelectronics trade show, held in Phoenix for the first time, and signed an agreement while they were here. ASU, the Arizona Commerce Authority, the city of Phoenix and Taiwan Digital Health Industry Development Association all signed a “declaration of collaboration” to promote Taiwanese companies in the U.S. and global markets with Arizona as a hub.

The signing also celebrated the opening of the Taiwan AI Smart Health Showcase Center, which features 15 innovative Taiwan-based health care companies, based in the 850 PBC building in the Phoenix Bioscience Core.

The agreement’s goals are to:

“Advancement in biomedical and medical device industries will not only drive innovation in patient care and scientific discovery, it will produce devices and therapies that will help treat chronic conditions and reduce health care costs,” Crow said at the signing.

“Arizona State University is excited to be part of this collaborative effort, working with partners in Arizona and Taiwan, to strengthen resilience in this important area of technological convergence.”

While in Taiwan, Crow met with the president and leadership team of National Yang Ming Chiao Tung University.

O’Sullivan said that ASU is comparable to NYCU, which not only has expertise in semiconductors but also created one of the first biomedical engineering-based medical schools, similar to ASU’s new John Shufeldt School of Medicine and Medical Engineering.

“We’re working toward building a comprehensive partnership with them, including a seed research fund and curriculum exchanges,” she said.

“We also met with the Ministry of Education and talked about building English and Mandarin language training, back and forth, to further support students and exchanges.”

A key part of Crow’s visit was meeting with the leadership team at TSMC, where he thanked them for their partnership with ASU, which is the No. 1 supplier of workers to them in Arizona.

“ASU’s partnership with TSMC and Taiwan fuses leading semiconductor innovation with bold research and scalable talent pipelines, which will be the foundation for our AI and quantum future,” O’Sullivan said.

“It’s a catalyst for U.S. leadership and will create trillions in global impact.”

The trip also included meetings with leadership from the Industrial Technology Research Institute, the Ministry of Economic Affairs and the Ministry of Foreign Affairs, the latter two highlighting ASU’s Innovation Zones as a catalyst for enhancing STEM research, education and development.

While in Asia, Crow traveled to South Korea, where he met with LG Energy Solution, which has invested $5.5 billion in battery manufacturing facilities in Queen Creek, Arizona; NAVER, the dominant search engine in South Korea; KRAFTON, one of the world’s largest video gaming companies; and education leaders. 

 

When a person needs emergency services, the first person they speak with is rarely a firefighter, police officer or paramedic. It’s a 911 operator or call taker, broadly called public safety…

Wayne Johnson’s story is one of persistence across decades.A Vietnam veteran and a father, he had always dreamed of teaching at the college level. That dream, however, kept being delayed by the…

Artificial intelligence is reshaping how people create, share and trust information, and Arizona State University is positioning itself at the forefront of that transformation.The ASU Knight…


Contact ASU News


Manage subscriptions"
